{"$schema":"https://json-schema.org/draft/2020-12/schema","$id":"https://recrafts.local/contracts/artifact-decision.schema.json","type":"object","additionalProperties":false,"required":["decision_id","candidate_package_id","actor","actor_role","verdict","created_at","accepted_risks","resolved_conflicts","notes"],"properties":{"decision_id":{"type":"string","minLength":1},"candidate_package_id":{"type":"string","pattern":"^package-"},"actor":{"type":"string","minLength":1},"actor_role":{"enum":["project-owner","authorized-reviewer"]},"verdict":{"enum":["PASS","PASS_WITH_CHANGES","REWORK","REJECT"]},"changes_completed":{"type":"boolean"},"created_at":{"type":"string","minLength":1},"accepted_risks":{"type":"array","items":{"type":"object","additionalProperties":false,"required":["conflict_id","risk_statement","accepted_scope"],"properties":{"conflict_id":{"type":"string"},"risk_statement":{"type":"string","minLength":1},"accepted_scope":{"type":"string","minLength":1}}}},"resolved_conflicts":{"type":"array","items":{"type":"string"},"uniqueItems":true},"notes":{"type":"string"}}}
